{
  "schemaVersion": 1,
  "runId": "ux-delivery-recovery-20261028",
  "canonical": {
    "role": "client",
    "path": ".scratch/ux-delivery-recovery"
  },
  "runArtifact": "active-run",
  "candidateId": "electron-history-20261029-8",
  "integrationBranches": {
    "client": "codex/ux-delivery-recovery-integration"
  }
}
